rank,channel_name,playlist_title,language,level,video_count,duration_hours,description,channel_url,playlist_url
1,Corey Schafer,Python OOP Tutorials - Working with Classes,English,Intermediate,6,2,Focuses on Object-Oriented Programming principles including classes inheritance and special methods.,https://www.youtube.com/@coreyms,https://www.youtube.com/playlist?list=PL-osiE80TeTsqhIuOqKhwlXsIBIdSeYtc
2,Tech With Tim,Expert Python Tutorials,English,Advanced,6,2,Advanced topics such as decorators generators and dunder methods for experienced developers.,https://www.youtube.com/@TechWithTim,https://www.youtube.com/playlist?list=PLzMcBGfZo4-kwmIcMDdXSuy_wSqtU-xDP
3,Sentdex,Machine Learning with Python,English,Intermediate-Advanced,72,10,Deep dives into the math and application of machine learning algorithms from scratch.,https://www.youtube.com/@sentdex,https://www.youtube.com/playlist?list=PLQVvvaa0QuDfKTOs3Keq_kaG2P55YRn5v
4,freeCodeCamp.org,Data Analysis with Python Course,English,Beginner-Intermediate,10,19,Comprehensive training on using libraries like Numpy Pandas and Matplotlib.,https://www.youtube.com/@freecodecamp,https://www.youtube.com/playlist?list=PLWKjhJtqVAblvI1i46ScbKV2jH1gdL7VQ
5,Tech With Tim,Python Machine Learning Tutorials,English,Intermediate,20,5,Practical implementation of machine learning using Scikit-learn and other popular libraries.,https://www.youtube.com/@TechWithTim,https://www.youtube.com/playlist?list=PLzMcBGfZo4-mP7qA9cagf68V06sko5otr
6,Sentdex,Intermediate Python Programming,English,Intermediate,22,4,Bridge the gap between beginner and advanced Python with topics like multithreading and argument parsing.,https://www.youtube.com/@sentdex,https://www.youtube.com/playlist?list=PLQVvvaa0QuDfju7ADVp5W1GF9jVhjbX-_
7,Corey Schafer,Python Tutorials,English,Beginner-Advanced,130,30,Widely considered one of the best general-purpose Python series for all skill levels.,https://www.youtube.com/@coreyms,https://www.youtube.com/playlist?list=PL-osiE80TeTt2d9bfVyTiXJA-UTHn6WwU
8,Programming with Mosh,Python Tutorials,English,Beginner,25,6,Very clear high-quality production focusing on the core essentials for quick learning.,https://www.youtube.com/@programmingwithmosh,https://www.youtube.com/playlist?list=PLTjRvDozrdlyj5wgH4qkvwSOdHLOCx10f
9,Bro Code,Python Tutorial for Beginners,English,Beginner,100,12,A massive all-in-one beginner course that covers syntax data structures and GUI development.,https://www.youtube.com/@BroCodez,https://www.youtube.com/playlist?list=PLZPZq0r_RZOOkUQbat8LyQii36cJf2SWT
10,freeCodeCamp.org,Python Tutorials,English,Beginner-Advanced,20,40,A collection of various Python paths including beginner basics and scientific computing.,https://www.youtube.com/@freecodecamp,https://www.youtube.com/playlist?list=PLWKjhJtqVAbnqBxcdjVGgT3uVR10bzTEB
11,Telusko,Python Tutorial 2026,English,Beginner-Advanced,120,12,A complete updated course for 2026 covering Python from the ground up to advanced concepts.,https://www.youtube.com/@Telusko,https://www.youtube.com/playlist?list=PLsyeobzWxl7omDoEYrrf3oXvXxa6MPgek
 